{
  "invited": "did:cid:bagaaiera62jw6kjy3x43zndooqapq2yu6e47tgfkac6ksuxj4bphvcoplzna",
  "invitedTo": "did:cid:bagaaiera3qko5a3y6w4bjvr3iedqjt5flkvqi4gm2ytjip3c2ix25hezflzq",
  "inviter": "did:cid:bagaaieravnv5onsflewvrz6urhwfjixfnwq7bgc3ejhlrj2nekx75ddhdupq",
  "inviteNonce": "b3a2c0a8-9a2b-4c36-9e14-7d1c39f0a5d2",
  "validFrom": "2026-02-19T00:00:00Z",
  "validUntil": "2026-03-19T00:00:00Z",
  "terms": "https://example.org/dtg/terms/v1"
}
